{
  "contract": {
    "public_only": true,
    "raw_private_source_forbidden": true,
    "semantic_declassification": true
  },
  "corpus_digest": "20c466f170839ac07e07bb80f0ffbcbe7385972f854587b4a918fbf0a5ee45cb",
  "declassification_policy_version": 1,
  "generated_at": "2026-09-23T11:32:15.025987Z",
  "record_count": 43,
  "release_id": "newswire-20c466f170839ac07e07bb80",
  "schema": "fcmo-newswire-airlock-v2",
  "schema_version": 2,
  "state": "READY_FOR_PUBLICATION"
}
